{
  "schemaVersion": "mkm-flight-distribution/1",
  "product": "inspection-record",
  "organizationId": "11111111-1111-4111-8111-111111111111",
  "airportId": "22222222-2222-4222-8222-222222222222",
  "stationAirport": "SHI",
  "timezone": "Asia/Tokyo",
  "releaseId": "0d286e84-69da-4ed5-b261-74ff38d6d2e7",
  "dataVersion": 1,
  "publishedAt": "2026-09-20T00:00:00.000Z",
  "preview": true,
  "coverage": {
    "from": "2026-09-01",
    "to": "2026-10-24"
  },
  "localDate": "2026-09-20",
  "status": "available",
  "activeScheduleCount": 1,
  "sha256": "f2b84d0f1b3e0e40ce5cf8469a8f0491c91fbf3f5fea88d3242c60c9188e60cb",
  "byteLength": 718,
  "dataPath": "/v1/receiver/releases/0d286e84-69da-4ed5-b261-74ff38d6d2e7"
}
